<?xml version="1.0" encoding="UTF-8"?>

<!ELEMENT bdProductos (producto)+>
<!ATTLIST bdProductos codigo NMTOKEN #REQUIRED>
<!ELEMENT producto (nombre,codigo,categoria,iva,precio,descuento)>
<!ELEMENT nombre (#PCDATA)>
<!ELEMENT codigo (#PCDATA)>
<!ELEMENT categoria (#PCDATA)>
<!ELEMENT iva (#PCDATA)>
<!ELEMENT precio (#PCDATA)>
<!ELEMENT descuento (#PCDATA)>

